id,bookId,pageNumber,branchPath,isBranchPage,content,imageUrl,panels,choiceA,choiceB,nextPageIdA,nextPageIdB,sfxTags,format,createdAt
450009,450002,9,A-A-A,0,"Tolgar, roketin kontrol düğmelerini nazikçe çevirdi. Ay'ın gri yüzeyine doğru yavaşça süzüldüler. Bir bulut gibi hafifçe yere kondular; incecik Ay tozu etrafa yayıldı. Tuğra, yuvarlak gözleriyle pencereden dışarı baktı. Karşılarında sessiz, sihirli bir dünya vardı.

Tolgar, oğlunun yumuşak saçlarını okşayarak gülümsedi. Birlikte roketten indiler ve Ay'ın üzerinde minik adımlarla yürüdüler. Uzaktan, mavi ve pırıl pırıl Dünya'ya baktılar. Bu, ikisinin de kalbinde parlayan unutulmaz bir Ay yolculuğuydu. Tutulma başlamadan önce roketlerine geri dönüp, evlerinin sıcak kollarına doğru yola çıktılar.",https://d2xsxph8kpxj0f.cloudfront.net/310519663399842622/cuoraNs8SGWCiJUcwSXm4W/generated/1773430362806.png,,,,,,"[""landing"", ""silence"", ""footsteps""]",portrait,2026-03-13 19:33:00
450010,450002,10,A-A-B,0,"Tolgar, usta bir pilot gibi roketini Ay'ın yörüngesine nazikçe oturttu. Tuğra, pencereden dışarı bakarken Ay'ın üzerindeki dev kraterlere ve yüksek dağlara hayranlıkla baktı. Dünya, uzakta parlayan minik, mavi bir mücevher gibi görünüyordu; sanki onları eve çağırıyordu. Bu kısa keşif turu, baba ve oğul için gökyüzünde unutulmaz bir dans olmuştu.

Tolgar, Tuğra'nın yumuşak kahverengi saçlarını okşarken gülümsedi. ""Eve dönme zamanı, kahramanım,"" dedi sıcak sesiyle. Roket, Ay'a veda edip yavaşça Dünya'ya doğru süzülmeye başladı. Tuğra'nın kalbi, bu maceranın tatlı anılarıyla doluydu ve biliyordu ki, gökyüzü her zaman onlara yeni hikayeler fısıldayacaktı.",https://d2xsxph8kpxj0f.cloudfront.net/310519663399842622/cuoraNs8SGWCiJUcwSXm4W/generated/1773430367440.png,,,,,,"[""orbit"", ""awe"", ""distant hum""]",portrait,2026-03-13 19:33:00
450011,450002,11,A-B-A,0,"Tolgar, roketini Ay'ın tozlu yüzeyine usulca indirdi. Minik uzay gemileri hafifçe sallanıp durduğunda, Tuğra heyecanla pencereye yapıştı. Dışarıda, gri ve kraterlerle dolu Ay manzarası nefes kesiciydi. Sanki dev bir peynir dilimi gibiydi! Tolgar ve Tuğra, Ay yüzeyinde kısa bir keşif yaptılar. Pırıl pırıl Ay taşları topladılar ve uzaktan parlayan güzelim Dünya'ya el salladılar.

Güneş tutulması başlamadan hemen önce, bu harika macerayı geride bırakıp evlerine doğru yola çıktılar. Tuğra, babasının kucağında uykuya daldığında bile gülümsüyordu. Rüyasında, Ay'da topladığı parlak taşlarla oynuyor, Dünya'ya bakıp şarkılar söylüyordu. Bu macera, kalplerinde sonsuza dek parlayan bir yıldız gibi kalacaktı.",https://d2xsxph8kpxj0f.cloudfront.net/310519663399842622/cuoraNs8SGWCiJUcwSXm4W/generated/1773430370419.png,,,,,,"[""thud"", ""dust"", ""exploration""]",portrait,2026-03-13 19:33:00
450012,450002,12,A-B-B,0,"Tolgar, Ay'ın etrafında hızla ama nazikçe bir tur attı. Roketleri, gümüş topun etrafında dans eden küçük bir yıldız gibiydi. Tuğra, pencereden dışarıya hayranlıkla bakarken, Ay'ın hem aydınlık yüzünü hem de gizemli karanlık tarafını gördü. Her yer pırıl pırıl parlıyordu. Uzakta, Dünya mavi, yeşil ve beyaz renkleriyle dönen minicik bir top gibi görünüyordu.

Bu hızlı tur, onlara Ay'ın ne kadar büyük ve uzayın ne kadar sonsuz olduğunu hissettirdi. Tolgar, ""Vakit geldi, minik astronotum,"" dedi gülümseyerek. Tutulma başlamadan önce, sihirli roketleri onları evlerine, sıcacık yataklarına geri taşıdı. Tuğra, gözleri parlayarak uykuya dalarken, Ay'ın ve yıldızların maceralarını rüyalarında görmeye başladı.",https://d2xsxph8kpxj0f.cloudfront.net/310519663399842622/cuoraNs8SGWCiJUcwSXm4W/generated/1773430369292.png,,,,,,"[""fast flight"", ""wonder"", ""space sounds""]",portrait,2026-03-13 19:33:00
450013,450002,13,B-A-A,0,"Roket, Ay'ın gümüş rengi kraterli yüzeyine tüy gibi nazikçe kondu. Tuğra, pencereden dışarı bakarken Ay'ın sessiz ve gizemli dünyasına hayran kaldı. Her yer bembeyaz bir tozla kaplıydı, sanki dev bir şekerleme tabağı gibiydi. Tolgar ve minik Tuğra, Ay yüzeyinde küçük, hafif adımlar attılar. Ayak izleri, yumuşacık tozlu zeminde minik sır kutuları gibi belirginleşti.

Uzakta, masmavi ve pırıl pırıl parlayan Dünya'ya el salladılar. Ay'ın büyülü sessizliğini dinlediler ve kalplerine bu unutulmaz anları sakladılar. Güneş tutulması başlamadan hemen önce, roketleri onları evlerine, sıcak yataklarına geri götürdü. Tuğra, yatağına uzandığında bile Ay'ın parıltısı ve babasıyla yaşadığı bu harika macera gözlerinin önündeydi. Tatlı uykusunda bile gülümsüyordu, çünkü biliyordu ki hayaller her zaman gerçek olabilirdi.",https://d2xsxph8kpxj0f.cloudfront.net/310519663399842622/cuoraNs8SGWCiJUcwSXm4W/generated/1773430376729.png,,,,,,"[""soft landing"", ""quiet"", ""moonwalk""]",portrait,2026-03-13 19:33:00
450014,450002,14,B-A-B,0,"Tolgar, roketini Ay'ın bembeyaz yörüngesine usulca sabitledi. Tuğra, pencereden dışarı baktığında gözleri kocaman açıldı. Ay, dev bir peynir gibi yakındı, üzerinde minik kraterler ve gölgeler vardı. ""Baba, Ay ne kadar da büyük!"" diye fısıldadı Tuğra, parmağıyla işaret ederek. Tolgar, oğlunun saçlarını okşadı. ""Evet, tatlım. Ve bak, Dünya orada, uzayın derinliklerinde parlayan mavi bir inci gibi.""

Ay'ın etrafında kısa bir tur attılar, sanki uzayda dans ediyorlardı. Dünya'ya geri dönme vakti geldiğinde, Tuğra'nın kalbi hem macera dolu hem de sıcacık hissediyordu. Bu, gökyüzünde yaşadıkları sihirli bir rüyaydı. Tolgar gülümsedi, ""Evimize dönüyoruz, minik astronotum. Ama bu maceranın hatırası hep kalbimizde parlayacak."" İkisi de, yıldızların arasında geçirdikleri bu unutulmaz yolculukla evlerine doğru süzülmeye başladılar.",https://d2xsxph8kpxj0f.cloudfront.net/310519663399842622/cuoraNs8SGWCiJUcwSXm4W/generated/1773430373286.png,,,,,,"[""orbital view"", ""awe"", ""gentle hum""]",portrait,2026-03-13 19:33:00
450015,450002,15,B-B-A,0,"Tolgar, roketini Ay'ın gri yüzeyine doğru nazikçe indirdi. Küçük bir sarsıntıyla durduklarında, Tuğra neşeyle kıkırdadı. Pencereden dışarı baktıklarında, her yer bembeyaz ve tozlu görünüyordu, tıpkı dev bir şekerleme tarlası gibi! Ay'ın üzerinde minik adımlarla yürüdüler, parıldayan Ay taşları topladılar ve uzaktan mavi Dünya'ya el salladılar.

Güneş tutulması başlamadan hemen önce, Tolgar ve Tuğra, roketleriyle evlerine doğru yola çıktılar. Kalpleri macera dolu, cepleri Ay taşlarıyla doluydu. Yataklarına uzandıklarında, Ay'ın onlara gülümsediğini hissettiler. Bu, unutulmaz bir geceydi ve ikisi de tatlı rüyalara daldılar, bir sonraki macerayı hayal ederek.",https://d2xsxph8kpxj0f.cloudfront.net/310519663399842622/cuoraNs8SGWCiJUcwSXm4W/generated/1773430379401.png,,,,,,"[""hard landing"", ""laughter"", ""quick steps""]",portrait,2026-03-13 19:33:00
450016,450002,16,B-B-B,0,"Tolgar, roketin hızını hiç düşürmeden Ay'ın etrafında pırıl pırıl bir tur attı. Tuğra, pencereden dışarı bakarken Ay'ın kocaman kraterlerini ve uzun gölgelerini hızla geçtiklerini gördü. Minik ağzı şaşkınlıkla açık kaldı. Uzaklarda, Dünya küçücük, mavi ve parıldayan bir mücevher gibi görünüyordu. Bu hızlı ve eğlenceli tur, onlara uzayın ne kadar heyecanlı olduğunu gösterdi.

Tam da Ay tutulması başlamadan önce, Tolgar ve Tuğra unutulmaz bir macerayı tamamlayıp evlerine geri döndüler. Roketleri yumuşacık bir iniş yaptı. Tuğra, yatağında gözlerini açtığında, penceresinden Ay'ın nazikçe gülümsediğini gördü. Bu, şimdiye kadarki en güzel rüyaydı!",https://d2xsxph8kpxj0f.cloudfront.net/310519663399842622/cuoraNs8SGWCiJUcwSXm4W/generated/1773430379702.png,,,,,,"[""high speed"", ""thrill"", ""distant stars""]",portrait,2026-03-13 19:33:00
