id,bookId,pageNumber,branchPath,isBranchPage,content,imageUrl,panels,choiceA,choiceB,nextPageIdA,nextPageIdB,sfxTags,format,createdAt
390060,390004,16,B-A-B,0,"Ajanlarla yüzleşip, yeni varlığının gücünü onlara gösterdi. Çatışma şiddetliydi, Tolgar'ın kontrolsüz gücü her şeyi yerle bir etti. Ajanlar yenildi, ancak bu zafer Tolgar'a pahalıya mal oldu. Vücudu tamamen değişmiş, artık geri dönüşü olmayan bir noktaya gelmişti. Münih'in korkulan, efsanevi bir canavarı haline geldi. Güçlü şirket, onu bir tehdit olarak görmeyi bıraktı, çünkü o artık bir insan değildi, sadece bir yıkım gücüydü.",,"[{""bubbleType"": ""speech"", ""dialogue"": null, ""imageUrl"": ""https://d2xsxph8kpxj0f.cloudfront.net/310519663399842622/cuoraNs8SGWCiJUcwSXm4W/panels/390004-page16-top-1773116762706.png"", ""narration"": ""Tolgar, ajanlarla yüzleşir ve yeni gücünü sergilerken çatışma şiddetlenir."", ""position"": ""top-right"", ""speaker"": null}, {""bubbleType"": ""speech"", ""dialogue"": null, ""imageUrl"": ""https://d2xsxph8kpxj0f.cloudfront.net/310519663399842622/cuoraNs8SGWCiJUcwSXm4W/panels/390004-page16-bottom-left-1773116762968.png"", ""narration"": ""Ajanlar yenilir, ancak Tolgar'ın vücudu geri dönüşü olmayan bir şekilde değişmiştir."", ""position"": ""top-left"", ""speaker"": null}, {""bubbleType"": ""speech"", ""dialogue"": null, ""imageUrl"": ""https://d2xsxph8kpxj0f.cloudfront.net/310519663399842622/cuoraNs8SGWCiJUcwSXm4W/panels/390004-page16-bottom-right-1773116768636.png"", ""narration"": ""Münih'in korkulan canavarı haline gelen Tolgar, şirket için artık bir tehdit değil, yıkım gücüdür."", ""position"": ""top-right"", ""speaker"": null}]",,,,,"[""explosion"", ""roar""]",landscape,2026-03-10 04:26:38
390061,390004,17,B-B-A,0,"Şirketin ana üssüne sızıp, projenin tüm verilerini yok etmeye karar verdi. Gizlice içeri girdi, keskin duyuları ve artan gücü sayesinde güvenlik sistemlerini aştı. Veri merkezine ulaştığında, tüm bilgileri silerek projenin sonunu getirdi. Ancak kaçışı sırasında çıkan çatışmada ağır yaralandı. Güçlerini son bir kez kullanarak kendini iyileştirdi, ancak bu onu çok yordu. Artık normal bir hayat sürebilirdi, ancak güçlerinin bedelini ödemişti. Bir kahraman olarak anılacak, ama sıradan bir insan olarak yaşayacaktı.",,"[{""bubbleType"": ""speech"", ""dialogue"": null, ""imageUrl"": ""https://d2xsxph8kpxj0f.cloudfront.net/310519663399842622/cuoraNs8SGWCiJUcwSXm4W/panels/390004-page17-top-1773116782800.png"", ""narration"": ""Tolgar, şirketin ana üssüne sızarak güvenlik sistemlerini aştı ve projenin tüm verilerini yok etti."", ""position"": ""top-right"", ""speaker"": null}, {""bubbleType"": ""speech"", ""dialogue"": null, ""imageUrl"": ""https://d2xsxph8kpxj0f.cloudfront.net/310519663399842622/cuoraNs8SGWCiJUcwSXm4W/panels/390004-page17-bottom-left-1773116786714.png"", ""narration"": ""Kaçışı sırasında çıkan çatışmada ağır yaralandı, ancak güçlerini kullanarak kendini son bir kez iyileştirdi."", ""position"": ""top-left"", ""speaker"": null}, {""bubbleType"": ""speech"", ""dialogue"": null, ""imageUrl"": ""https://d2xsxph8kpxj0f.cloudfront.net/310519663399842622/cuoraNs8SGWCiJUcwSXm4W/panels/390004-page17-bottom-right-1773116792708.png"", ""narration"": ""Güçlerinin bedelini ödeyen Tolgar, artık normal bir hayat sürecek, bir kahraman olarak anılacak ama sıradan bir insan olarak yaşayacaktı."", ""position"": ""top-right"", ""speaker"": null}]",,,,,"[""hacking"", ""explosion""]",landscape,2026-03-10 04:26:38
390062,390004,18,B-B-B,0,"Şirketin ajanlarına karşı açıkça savaşmaya ve onları alt etmeye karar verdi. Münih sokaklarında destansı bir çatışma yaşandı. Tolgar, güçlerini ustaca kullanarak tüm ajanları teker teker etkisiz hale getirdi. Şirket, bu yenilgi karşısında geri çekilmek zorunda kaldı. Tolgar, artık Münih'in koruyucusu, adaletin sembolü olmuştu. Güçlerini insanlığın iyiliği için kullanmaya yemin etti ve 'Deney 27' artık bir korku hikayesi değil, bir umut ışığıydı.",,"[{""bubbleType"": ""speech"", ""dialogue"": null, ""imageUrl"": ""https://d2xsxph8kpxj0f.cloudfront.net/310519663399842622/cuoraNs8SGWCiJUcwSXm4W/panels/390004-page18-top-1773116782937.png"", ""narration"": ""Tolgar, şirketin ajanlarına karşı açıkça savaşmaya karar verdi ve Münih sokaklarında destansı bir çatışma yaşandı."", ""position"": ""top-right"", ""speaker"": null}, {""bubbleType"": ""speech"", ""dialogue"": null, ""imageUrl"": ""https://d2xsxph8kpxj0f.cloudfront.net/310519663399842622/cuoraNs8SGWCiJUcwSXm4W/panels/390004-page18-bottom-left-1773116792704.png"", ""narration"": ""Tolgar, güçlerini ustaca kullanarak tüm ajanları teker teker etkisiz hale getirdi ve şirket geri çekilmek zorunda kaldı."", ""position"": ""top-left"", ""speaker"": null}, {""bubbleType"": ""speech"", ""dialogue"": null, ""imageUrl"": ""https://d2xsxph8kpxj0f.cloudfront.net/310519663399842622/cuoraNs8SGWCiJUcwSXm4W/panels/390004-page18-bottom-right-1773116793844.png"", ""narration"": ""Tolgar, Münih'in koruyucusu, adaletin sembolü olmuştu ve 'Deney 27' artık bir umut ışığıydı."", ""position"": ""top-right"", ""speaker"": null}]",,,,,"[""heroic music"", ""battle""]",landscape,2026-03-10 04:26:38
420001,420001,1,root,0,"Münih'teki laboratuvarın soğuk ışıkları altında Tolgar, insan hücrelerinin kendini onarma kapasitesini artırmaya yönelik projesi üzerinde çalışıyordu. Gecenin geç saatleriydi ve laboratuvar neredeyse boştu. Deney tüplerindeki parlak mavi serum, Tolgar'ın yorgun ama kararlı yüzünü aydınlatıyordu. Bir anlık dalgınlık, her şeyi değiştirecekti.",,"[{""bubbleType"": ""speech"", ""dialogue"": null, ""imageUrl"": ""https://d2xsxph8kpxj0f.cloudfront.net/310519663399842622/cuoraNs8SGWCiJUcwSXm4W/panels/420001-page1-top-1773419725807.png"", ""narration"": ""In a cold Munich lab, Tolgar works on his cell repair project late at night."", ""position"": ""top-right"", ""speaker"": null}, {""bubbleType"": ""speech"", ""dialogue"": null, ""imageUrl"": ""https://d2xsxph8kpxj0f.cloudfront.net/310519663399842622/cuoraNs8SGWCiJUcwSXm4W/panels/420001-page1-bottom-left-1773419731381.png"", ""narration"": ""Bright blue serum in test tubes illuminates Tolgar's tired yet determined face."", ""position"": ""top-left"", ""speaker"": null}, {""bubbleType"": ""speech"", ""dialogue"": null, ""imageUrl"": ""https://d2xsxph8kpxj0f.cloudfront.net/310519663399842622/cuoraNs8SGWCiJUcwSXm4W/panels/420001-page1-bottom-right-1773419736586.png"", ""narration"": ""A moment of distraction is about to change everything for Tolgar."", ""position"": ""top-right"", ""speaker"": null}]",,,,,"[""laboratuvar"", ""uğultu"", ""cam kırılması""]",landscape,2026-03-13 16:38:26
420002,420001,2,root,1,"Tolgar, elindeki deneysel serum tüpünü yanlışlıkla düşürdü. Tüp yere düşer düşmez paramparça oldu ve içindeki parlak mavi sıvı, Tolgar'ın koruyucu giysisindeki küçük bir yırtıktan cildine sızdı. Keskin bir acı hissetti, ardından vücudunda garip bir karıncalanma yayıldı. Ne yapacağını bilemez halde, şaşkınlıkla etrafına bakındı.",,"[{""bubbleType"": ""speech"", ""dialogue"": null, ""imageUrl"": ""https://d2xsxph8kpxj0f.cloudfront.net/310519663399842622/cuoraNs8SGWCiJUcwSXm4W/panels/420001-page2-top-1773419731224.png"", ""narration"": ""Tolgar, elindeki deneysel serum tüpünü yanlışlıkla düşürdü."", ""position"": ""top-right"", ""speaker"": null}, {""bubbleType"": ""speech"", ""dialogue"": null, ""imageUrl"": ""https://d2xsxph8kpxj0f.cloudfront.net/310519663399842622/cuoraNs8SGWCiJUcwSXm4W/panels/420001-page2-bottom-left-1773419736788.png"", ""narration"": ""Tüp yere düşer düşmez paramparça oldu ve içindeki parlak mavi sıvı, Tolgar'ın koruyucu giysisindeki küçük bir yırtıktan cildine sızdı."", ""position"": ""top-left"", ""speaker"": null}, {""bubbleType"": ""speech"", ""dialogue"": null, ""imageUrl"": ""https://d2xsxph8kpxj0f.cloudfront.net/310519663399842622/cuoraNs8SGWCiJUcwSXm4W/panels/420001-page2-bottom-right-1773419742006.png"", ""narration"": ""Keskin bir acı hissetti, ardından vücudunda garip bir karıncalanma yayıldı. Ne yapacağını bilemez halde, şaşkınlıkla etrafına bakındı."", ""position"": ""top-right"", ""speaker"": null}]",Hemen tıbbi yardım ara ve durumu rapor et.,"Kimseye bir şey söyleme, etkilerini gözlemle.",420003,420004,"[""şok"", ""karıncalanma"", ""sessizlik""]",landscape,2026-03-13 16:38:27
420003,420001,3,A,0,"Tolgar, hızla laboratuvarın acil durum hattını aradı ve durumu rapor etti. Kısa süre içinde bir tıbbi ekip olay yerine geldi. Serumun etkileri hakkında bilgi vermesi istendiğinde, Tolgar'ın sesi düşünceli ve biraz gergindi. ""Sadece küçük bir temas,"" diye mırıldandı, gerçek etkileri tam olarak anlamadan.",,"[{""bubbleType"": ""speech"", ""dialogue"": null, ""imageUrl"": ""https://d2xsxph8kpxj0f.cloudfront.net/310519663399842622/cuoraNs8SGWCiJUcwSXm4W/panels/420001-page3-top-1773419736580.png"", ""narration"": ""Tolgar, laboratuvarın acil durum hattını arayarak durumu rapor etti."", ""position"": ""top-right"", ""speaker"": null}, {""bubbleType"": ""speech"", ""dialogue"": null, ""imageUrl"": ""https://d2xsxph8kpxj0f.cloudfront.net/310519663399842622/cuoraNs8SGWCiJUcwSXm4W/panels/420001-page3-bottom-left-1773419742002.png"", ""narration"": ""Kısa süre içinde bir tıbbi ekip olay yerine geldi ve bilgi istedi."", ""position"": ""top-left"", ""speaker"": null}, {""bubbleType"": ""speech"", ""dialogue"": ""Sadece küçük bir temas."", ""imageUrl"": ""https://d2xsxph8kpxj0f.cloudfront.net/310519663399842622/cuoraNs8SGWCiJUcwSXm4W/panels/420001-page3-bottom-right-1773419747198.png"", ""narration"": ""Tolgar'ın sesi düşünceli ve gergindi, etkileri tam anlamadı."", ""position"": ""top-right"", ""speaker"": ""Tolgar""}]",,,,,"[""telefon"", ""siren"", ""endişe""]",landscape,2026-03-13 16:38:28
420004,420001,4,B,0,"Tolgar, kimseye bir şey söylememeye karar verdi. Cildindeki karıncalanma yavaş yavaş azaldı ama içten gelen garip bir enerji hissi tüm vücuduna yayılmıştı. Laboratuvardan ayrılırken adımları her zamankinden daha hafif, duyuları ise keskinleşmişti. Bu gizemi kendi başına çözmeye kararlıydı.",,"[{""bubbleType"": ""speech"", ""dialogue"": null, ""imageUrl"": ""https://d2xsxph8kpxj0f.cloudfront.net/310519663399842622/cuoraNs8SGWCiJUcwSXm4W/panels/420001-page4-top-1773419726088.png"", ""narration"": ""Tolgar, yaşadığı garip olayı kimseye anlatmamaya karar verirken cildindeki karıncalanma azalır."", ""position"": ""top-right"", ""speaker"": null}, {""bubbleType"": ""speech"", ""dialogue"": null, ""imageUrl"": ""https://d2xsxph8kpxj0f.cloudfront.net/310519663399842622/cuoraNs8SGWCiJUcwSXm4W/panels/420001-page4-bottom-left-1773419731390.png"", ""narration"": ""Ancak içten gelen garip bir enerji tüm vücuduna yayılmış, onu farklı hissettirmiştir."", ""position"": ""top-left"", ""speaker"": null}, {""bubbleType"": ""speech"", ""dialogue"": null, ""imageUrl"": ""https://d2xsxph8kpxj0f.cloudfront.net/310519663399842622/cuoraNs8SGWCiJUcwSXm4W/panels/420001-page4-bottom-right-1773419736591.png"", ""narration"": ""Laboratuvardan ayrılırken adımları hafif, duyuları keskinleşmiş Tolgar, bu gizemi tek başına çözmeye kararlıdır."", ""position"": ""top-right"", ""speaker"": null}]",,,,,"[""nefes alma"", ""kalp atışı"", ""uğultu""]",landscape,2026-03-13 16:38:29
420005,420001,5,A,0,"Tıbbi ekip, Tolgar'ı detaylı bir kontrolden geçirdi. İlk testler herhangi bir anormallik göstermedi. Ancak Tolgar, içten içe bir şeylerin değiştiğini hissediyordu. Duyuları keskinleşmiş, çevresindeki sesleri ve kokuları daha yoğun algılamaya başlamıştı. Doktorlar onu eve gönderirken, Tolgar'ın zihni bu yeni hislerle doluydu.",,"[{""bubbleType"": ""speech"", ""dialogue"": null, ""imageUrl"": ""https://d2xsxph8kpxj0f.cloudfront.net/310519663399842622/cuoraNs8SGWCiJUcwSXm4W/panels/420001-page5-top-1773419726413.png"", ""narration"": ""Tıbbi ekip, Tolgar'ı detaylı bir kontrolden geçirdi ve ilk testler anormallik göstermedi."", ""position"": ""top-right"", ""speaker"": null}, {""bubbleType"": ""speech"", ""dialogue"": null, ""imageUrl"": ""https://d2xsxph8kpxj0f.cloudfront.net/310519663399842622/cuoraNs8SGWCiJUcwSXm4W/panels/420001-page5-bottom-left-1773419736605.png"", ""narration"": ""Tolgar içten içe bir şeylerin değiştiğini, duyularının keskinleştiğini hissediyordu."", ""position"": ""top-left"", ""speaker"": null}, {""bubbleType"": ""speech"", ""dialogue"": null, ""imageUrl"": ""https://d2xsxph8kpxj0f.cloudfront.net/310519663399842622/cuoraNs8SGWCiJUcwSXm4W/panels/420001-page5-bottom-right-1773419741999.png"", ""narration"": ""Doktorlar onu eve gönderirken, Tolgar'ın zihni bu yeni yoğun hislerle doluydu."", ""position"": ""top-right"", ""speaker"": null}]",,,,,"[""tıbbi ekipman"", ""nabız"", ""sessizlik""]",landscape,2026-03-13 16:38:29
420006,420001,6,B,0,"Sonraki birkaç gün boyunca Tolgar, vücudundaki değişimleri dikkatle gözlemledi. Geceleri uyumakta zorlanıyor, en ufak bir sesi bile duyabiliyordu. Bir sabah aynaya baktığında, gözlerinin her zamankinden daha parlak olduğunu fark etti. Fiziksel gücü de artmış gibiydi; ağır nesneleri kolayca kaldırabiliyordu. Bu durum onu hem heyecanlandırıyor hem de korkutuyordu.",,"[{""bubbleType"": ""speech"", ""dialogue"": null, ""imageUrl"": ""https://d2xsxph8kpxj0f.cloudfront.net/310519663399842622/cuoraNs8SGWCiJUcwSXm4W/panels/420001-page6-top-1773419769479.png"", ""narration"": ""Tolgar, vücudundaki değişimleri dikkatle gözlemleyerek uykusuz geceler geçiriyor."", ""position"": ""top-right"", ""speaker"": null}, {""bubbleType"": ""speech"", ""dialogue"": null, ""imageUrl"": ""https://d2xsxph8kpxj0f.cloudfront.net/310519663399842622/cuoraNs8SGWCiJUcwSXm4W/panels/420001-page6-bottom-left-1773419775636.png"", ""narration"": ""Bir sabah aynaya baktığında, gözlerinin parlaklaştığını ve fiziksel gücünün arttığını fark eder."", ""position"": ""top-left"", ""speaker"": null}, {""bubbleType"": ""speech"", ""dialogue"": null, ""imageUrl"": ""https://d2xsxph8kpxj0f.cloudfront.net/310519663399842622/cuoraNs8SGWCiJUcwSXm4W/panels/420001-page6-bottom-right-1773419779786.png"", ""narration"": ""Bu yeni güç, Tolgar'ı hem heyecanlandırıyor hem de bilinmeyene karşı korkutuyor."", ""position"": ""top-right"", ""speaker"": null}]",,,,,"[""nefes alma"", ""kalp atışı"", ""uğultu""]",landscape,2026-03-13 16:38:30
420007,420001,7,A,1,"Laboratuvara döndüğünde, Tolgar'ın meslektaşları ona endişeli gözlerle bakıyordu. Şirket yönetimi, serum kazası hakkında soruşturma başlatmıştı. Tolgar'ın içgüdüleri, bu serumun sadece hücre yenilenmesini hızlandırmakla kalmayıp, çok daha fazlasını yaptığını söylüyordu. Şirketin gizli bir gündemi olabileceği şüphesi zihnini kemiriyordu.",,"[{""bubbleType"": ""speech"", ""dialogue"": null, ""imageUrl"": ""https://d2xsxph8kpxj0f.cloudfront.net/310519663399842622/cuoraNs8SGWCiJUcwSXm4W/panels/420001-page7-top-1773419768893.png"", ""narration"": ""Tolgar returns to the lab, met by his colleagues' worried gazes."", ""position"": ""top-right"", ""speaker"": null}, {""bubbleType"": ""speech"", ""dialogue"": null, ""imageUrl"": ""https://d2xsxph8kpxj0f.cloudfront.net/310519663399842622/cuoraNs8SGWCiJUcwSXm4W/panels/420001-page7-bottom-left-1773419775402.png"", ""narration"": ""A company investigation begins into the serum accident."", ""position"": ""top-left"", ""speaker"": null}, {""bubbleType"": ""speech"", ""dialogue"": null, ""imageUrl"": ""https://d2xsxph8kpxj0f.cloudfront.net/310519663399842622/cuoraNs8SGWCiJUcwSXm4W/panels/420001-page7-bottom-right-1773419775585.png"", ""narration"": ""Tolgar suspects the serum does more than regenerate cells, hinting at a hidden agenda."", ""position"": ""top-right"", ""speaker"": null}]",Şirketin gizli gündemini araştırmaya başla.,Güçlerini saklamaya ve normal hayatına dönmeye çalış.,420008,420009,"[""fısıltılar"", ""gerginlik"", ""ayak sesleri""]",landscape,2026-03-13 16:38:30
420008,420001,8,A-A,0,"Tolgar, şirket bilgisayar sistemlerine sızarak gizli projelere dair ipuçları aramaya başladı. Kısa sürede, çalıştığı laboratuvarın 'İnsan Geliştirme Projesi' adı altında gizli deneyler yürüttüğünü keşfetti. Serum, sadece hücre yenilenmesi için değil, insanüstü yetenekler kazandırmak için tasarlanmıştı. Tolgar, bir denek haline gelmişti.",,"[{""bubbleType"": ""speech"", ""dialogue"": null, ""imageUrl"": ""https://d2xsxph8kpxj0f.cloudfront.net/310519663399842622/cuoraNs8SGWCiJUcwSXm4W/panels/420001-page8-top-1773419779920.png"", ""narration"": ""Tolgar, şirket bilgisayar sistemlerine sızarak gizli projelere dair ipuçları aramaya başladı."", ""position"": ""top-right"", ""speaker"": null}, {""bubbleType"": ""speech"", ""dialogue"": null, ""imageUrl"": ""https://d2xsxph8kpxj0f.cloudfront.net/310519663399842622/cuoraNs8SGWCiJUcwSXm4W/panels/420001-page8-bottom-left-1773419783693.png"", ""narration"": ""Kısa sürede, çalıştığı laboratuvarın 'İnsan Geliştirme Projesi' adı altında gizli deneyler yürüttüğünü keşfetti."", ""position"": ""top-left"", ""speaker"": null}, {""bubbleType"": ""speech"", ""dialogue"": null, ""imageUrl"": ""https://d2xsxph8kpxj0f.cloudfront.net/310519663399842622/cuoraNs8SGWCiJUcwSXm4W/panels/420001-page8-bottom-right-1773419783890.png"", ""narration"": ""Serum, sadece hücre yenilenmesi için değil, insanüstü yetenekler kazandırmak için tasarlanmıştı; Tolgar, bir denek haline gelmişti."", ""position"": ""top-right"", ""speaker"": null}]",,,,,"[""klavye"", ""bilgisayar"", ""gergin müzik""]",landscape,2026-03-13 16:38:30
420009,420001,9,A-B,0,"Tolgar, güçlerini saklamaya ve normal hayatına dönmeye karar verdi. Ancak bu hiç de kolay değildi. Keskinleşen duyuları ve artan gücü, günlük yaşamında sürekli sorunlar yaratıyordu. En ufak bir gürültü bile onu rahatsız ediyor, sıradan işler bile aşırı efor gerektiriyordu. İçindeki değişim, onu giderek daha fazla zorluyordu.",,"[{""bubbleType"": ""speech"", ""dialogue"": null, ""imageUrl"": ""https://d2xsxph8kpxj0f.cloudfront.net/310519663399842622/cuoraNs8SGWCiJUcwSXm4W/panels/420001-page9-top-1773419769684.png"", ""narration"": ""Tolgar, yeni güçlerini gizleyerek sıradan bir hayat sürmeye çalışır."", ""position"": ""top-right"", ""speaker"": null}, {""bubbleType"": ""speech"", ""dialogue"": null, ""imageUrl"": ""https://d2xsxph8kpxj0f.cloudfront.net/310519663399842622/cuoraNs8SGWCiJUcwSXm4W/panels/420001-page9-bottom-left-1773419779709.png"", ""narration"": ""Keskinleşen duyuları ve artan gücü, günlük yaşamında sürekli sorunlara yol açar."", ""position"": ""top-left"", ""speaker"": null}, {""bubbleType"": ""speech"", ""dialogue"": null, ""imageUrl"": ""https://d2xsxph8kpxj0f.cloudfront.net/310519663399842622/cuoraNs8SGWCiJUcwSXm4W/panels/420001-page9-bottom-right-1773419781514.png"", ""narration"": ""En ufak gürültü bile onu rahatsız ederken, içindeki değişim onu zorlar."", ""position"": ""top-right"", ""speaker"": null}]",,,,,"[""kalabalık"", ""uğultu"", ""hayal kırıklığı""]",landscape,2026-03-13 16:38:30
420010,420001,10,B,1,"Tolgar'ın güçleri her geçen gün daha da belirginleşiyordu. Bir gün, laboratuvarda çalışırken, elindeki bir aletin aniden eridiğini fark etti. Vücudu gizemli bir enerji üretebiliyordu, ancak bu enerjiyi kontrol edemiyordu. Bu durum, onu hem korkutuyor hem de yeni bir dünyanın kapılarını aralıyordu. Bu gücü ne yapacaktı?",,"[{""bubbleType"": ""speech"", ""dialogue"": null, ""imageUrl"": ""https://d2xsxph8kpxj0f.cloudfront.net/310519663399842622/cuoraNs8SGWCiJUcwSXm4W/panels/420001-page10-top-1773419779908.png"", ""narration"": ""Tolgar, laboratuvarda çalışırken elindeki aletin eridiğini şaşkınlıkla fark eder."", ""position"": ""top-right"", ""speaker"": null}, {""bubbleType"": ""speech"", ""dialogue"": null, ""imageUrl"": ""https://d2xsxph8kpxj0f.cloudfront.net/310519663399842622/cuoraNs8SGWCiJUcwSXm4W/panels/420001-page10-bottom-left-1773419783679.png"", ""narration"": ""Vücudundan kontrolsüzce yayılan gizemli enerjiyi dehşet içinde hisseder."", ""position"": ""top-left"", ""speaker"": null}, {""bubbleType"": ""speech"", ""dialogue"": ""Bu gücü ne yapacaktı?"", ""imageUrl"": ""https://d2xsxph8kpxj0f.cloudfront.net/310519663399842622/cuoraNs8SGWCiJUcwSXm4W/panels/420001-page10-bottom-right-1773419783847.png"", ""narration"": ""Tolgar, bu yeni ve korkutucu gücün gelecekteki etkilerini düşünürken endişelenir."", ""position"": ""top-right"", ""speaker"": ""Tolgar""}]",Güçlerini kontrol etmeyi öğrenmeye çalış.,Bu güçten kurtulmanın bir yolunu bulmaya çalış.,420011,420012,"[""enerji"", ""titreşim"", ""şok""]",landscape,2026-03-13 16:38:30
420011,420001,11,B-A,0,"Tolgar, gizlice güçlerini kontrol etme alıştırmaları yapmaya başladı. Odaklanarak küçük nesneleri hareket ettirmeye çalışıyor, enerjiyi yönlendirme yollarını arıyordu. Her deneme, vücudunda yeni bir mutasyonun tetiklenmesine neden oluyordu. Bu süreç, Tolgar'ı fiziksel ve zihinsel olarak zorluyordu ama o kararlıydı.",,"[{""bubbleType"": ""speech"", ""dialogue"": null, ""imageUrl"": ""https://d2xsxph8kpxj0f.cloudfront.net/310519663399842622/cuoraNs8SGWCiJUcwSXm4W/panels/420001-page11-top-1773419810328.png"", ""narration"": ""Tolgar, gizlice güçlerini kontrol etme alıştırmalarına başlıyor."", ""position"": ""top-right"", ""speaker"": null}, {""bubbleType"": ""speech"", ""dialogue"": null, ""imageUrl"": ""https://d2xsxph8kpxj0f.cloudfront.net/310519663399842622/cuoraNs8SGWCiJUcwSXm4W/panels/420001-page11-bottom-left-1773419815089.png"", ""narration"": ""Odaklanarak küçük nesneleri hareket ettirmeye çalışıyor ve enerjiyi yönlendirme yollarını arıyor."", ""position"": ""top-left"", ""speaker"": null}, {""bubbleType"": ""speech"", ""dialogue"": null, ""imageUrl"": ""https://d2xsxph8kpxj0f.cloudfront.net/310519663399842622/cuoraNs8SGWCiJUcwSXm4W/panels/420001-page11-bottom-right-1773419815390.png"", ""narration"": ""Her deneme yeni bir mutasyonu tetikliyor, Tolgar'ı zorluyor ama o kararlı."", ""position"": ""top-right"", ""speaker"": null}]",,,,,"[""uğultu"", ""odaklanma"", ""çatlama""]",landscape,2026-03-13 16:38:30
420012,420001,12,B-B,0,"Tolgar, bu tehlikeli güçten kurtulmanın yollarını aramaya başladı. Laboratuvarın veri tabanlarını, serumun yan etkileri ve antidotları hakkında bilgi bulmak için taradı. Ancak bulduğu her bilgi, serumun geri döndürülemez etkileri olduğunu gösteriyordu. Umutsuzluk, Tolgar'ın içini kemiriyordu.",,"[{""bubbleType"": ""speech"", ""dialogue"": null, ""imageUrl"": ""https://d2xsxph8kpxj0f.cloudfront.net/310519663399842622/cuoraNs8SGWCiJUcwSXm4W/panels/420001-page12-top-1773419820708.png"", ""narration"": ""Tolgar, bu tehlikeli güçten kurtulmanın yollarını aramaya başladı."", ""position"": ""top-right"", ""speaker"": null}, {""bubbleType"": ""speech"", ""dialogue"": null, ""imageUrl"": ""https://d2xsxph8kpxj0f.cloudfront.net/310519663399842622/cuoraNs8SGWCiJUcwSXm4W/panels/420001-page12-bottom-left-1773419825802.png"", ""narration"": ""Laboratuvarın veri tabanlarını, serumun yan etkileri ve antidotları hakkında bilgi bulmak için taradı."", ""position"": ""top-left"", ""speaker"": null}, {""bubbleType"": ""speech"", ""dialogue"": null, ""imageUrl"": ""https://d2xsxph8kpxj0f.cloudfront.net/310519663399842622/cuoraNs8SGWCiJUcwSXm4W/panels/420001-page12-bottom-right-1773419830980.png"", ""narration"": ""Ancak bulduğu her bilgi, serumun geri döndürülemez etkileri olduğunu gösteriyordu. Umutsuzluk, Tolgar'ın içini kemiriyordu."", ""position"": ""top-right"", ""speaker"": null}]",,,,,"[""klavye"", ""hızlı nefes"", ""hayal kırıklığı""]",landscape,2026-03-13 16:38:30
420013,420001,13,A-A,1,"Şirketin gizli projesini keşfettikten sonra Tolgar, büyük bir tehlikenin içinde olduğunu anladı. Şirket, onu yakalamak ve güçlerini kendi çıkarları için kullanmak isteyecekti. Artık bir denek değil, bir hedefti. Ne yapacağına karar vermeliydi: Kaçacak mıydı, yoksa savaşacak mıydı?",,"[{""bubbleType"": ""speech"", ""dialogue"": null, ""imageUrl"": ""https://d2xsxph8kpxj0f.cloudfront.net/310519663399842622/cuoraNs8SGWCiJUcwSXm4W/panels/420001-page13-top-1773419815181.png"", ""narration"": ""Tolgar, şirketin gizli projesini keşfettikten sonra büyük bir tehlikenin içinde olduğunu fark etti."", ""position"": ""top-right"", ""speaker"": null}, {""bubbleType"": ""speech"", ""dialogue"": null, ""imageUrl"": ""https://d2xsxph8kpxj0f.cloudfront.net/310519663399842622/cuoraNs8SGWCiJUcwSXm4W/panels/420001-page13-bottom-left-1773419820688.png"", ""narration"": ""Şirket, onu yakalamak ve güçlerini kendi çıkarları için kullanmak istiyordu; artık bir denek değil, bir hedefti."", ""position"": ""top-left"", ""speaker"": null}, {""bubbleType"": ""speech"", ""dialogue"": null, ""imageUrl"": ""https://d2xsxph8kpxj0f.cloudfront.net/310519663399842622/cuoraNs8SGWCiJUcwSXm4W/panels/420001-page13-bottom-right-1773419825498.png"", ""narration"": ""Tolgar, kaçmak ya da savaşmak arasında bir karar vermeliydi."", ""position"": ""top-right"", ""speaker"": null}]",Şirketten kaç ve saklan.,Şirketle yüzleş ve gerçeği ortaya çıkar.,420014,420015,"[""gergin müzik"", ""kalp atışı"", ""alarm""]",landscape,2026-03-13 16:38:30
