id,bookId,pageNumber,branchPath,isBranchPage,content,imageUrl,panels,choiceA,choiceB,nextPageIdA,nextPageIdB,sfxTags,format,createdAt
420014,420001,14,A-A-A,1,"Tolgar, şirketten kaçmaya karar verdi. Kimliğini gizleyerek, Münih'ten uzaklaşmaya çalıştı. Ancak şirket, onun izini sürmekte kararlıydı. Her köşe başında bir tehdit hissediyor, sürekli tetikte yaşıyordu. Yeni güçleri, kaçışında ona yardımcı olsa da, yalnızlık ve korku Tolgar'ı sarıyordu.",,"[{""bubbleType"": ""speech"", ""dialogue"": null, ""imageUrl"": ""https://d2xsxph8kpxj0f.cloudfront.net/310519663399842622/cuoraNs8SGWCiJUcwSXm4W/panels/420001-page14-top-1773419820887.png"", ""narration"": ""Tolgar, şirketten kaçmaya karar verir ve Münih'ten uzaklaşmaya çalışır."", ""position"": ""top-right"", ""speaker"": null}, {""bubbleType"": ""speech"", ""dialogue"": null, ""imageUrl"": ""https://d2xsxph8kpxj0f.cloudfront.net/310519663399842622/cuoraNs8SGWCiJUcwSXm4W/panels/420001-page14-bottom-left-1773419825799.png"", ""narration"": ""Şirket onun izini sürerken, Tolgar her köşe başında bir tehdit hisseder."", ""position"": ""top-left"", ""speaker"": null}, {""bubbleType"": ""speech"", ""dialogue"": null, ""imageUrl"": ""https://d2xsxph8kpxj0f.cloudfront.net/310519663399842622/cuoraNs8SGWCiJUcwSXm4W/panels/420001-page14-bottom-right-1773419830985.png"", ""narration"": ""Yeni güçleri ona yardımcı olsa da, yalnızlık ve korku Tolgar'ı sarar."", ""position"": ""top-right"", ""speaker"": null}]",Güçlerini kullanarak peşindekilerden kurtul.,Sivil bir hayat kurmaya çalış ve güçlerini gizle.,420016,420017,"[""ayak sesleri"", ""rüzgar"", ""gerginlik""]",landscape,2026-03-13 16:38:30
420015,420001,15,A-A-B,0,"Tolgar, şirketin karşısına dikilmeye karar verdi. Topladığı tüm kanıtlarla birlikte, şirketin gizli 'İnsan Geliştirme Projesi'ni kamuoyuna ifşa etti. Bu cesur hamle, büyük bir skandala yol açtı. Şirket yöneticileri tutuklandı ve Tolgar, bir kahraman olarak anılmaya başlandı. Ancak güçleri hala onunla ve her zaman bir tehdit olmaya devam edecekti. Tolgar, yeni bir başlangıç yapmaya hazırdı, ama artık asla eskisi gibi olmayacaktı. Kahramanlık bedeli ağırdı.",,"[{""bubbleType"": ""speech"", ""dialogue"": null, ""imageUrl"": ""https://d2xsxph8kpxj0f.cloudfront.net/310519663399842622/cuoraNs8SGWCiJUcwSXm4W/panels/420001-page15-top-1773419825484.png"", ""narration"": ""Tolgar, şirketin gizli 'İnsan Geliştirme Projesi'ni tüm kanıtlarla kamuoyuna ifşa etti."", ""position"": ""top-right"", ""speaker"": null}, {""bubbleType"": ""speech"", ""dialogue"": null, ""imageUrl"": ""https://d2xsxph8kpxj0f.cloudfront.net/310519663399842622/cuoraNs8SGWCiJUcwSXm4W/panels/420001-page15-bottom-left-1773419825892.png"", ""narration"": ""Bu cesur hamle büyük bir skandala yol açtı ve şirket yöneticileri tutuklandı."", ""position"": ""top-left"", ""speaker"": null}, {""bubbleType"": ""speech"", ""dialogue"": ""Asla eskisi gibi olmayacaktım."", ""imageUrl"": ""https://d2xsxph8kpxj0f.cloudfront.net/310519663399842622/cuoraNs8SGWCiJUcwSXm4W/panels/420001-page15-bottom-right-1773419830996.png"", ""narration"": ""Tolgar bir kahraman olarak anılmaya başlandı, ancak güçleri ve kahramanlığın bedeli onunla kalacaktı."", ""position"": ""top-right"", ""speaker"": ""Tolgar""}]",,,,,"[""alkış"", ""flaşlar"", ""zafer""]",landscape,2026-03-13 16:38:30
420016,420001,16,A-A-A-A,0,"Peşindekilerle yüzleşmek zorunda kalan Tolgar, güçlerini sonuna kadar kullandı. Vücudundan yayılan enerji dalgaları, onu yakalamaya çalışanları savurdu. Bu çatışma, Tolgar'ın mutasyonunu daha da hızlandırdı. Artık sadece insanüstü değil, bambaşka bir varlığa dönüşüyordu. Şirket, onu durdurmak için daha büyük bir ordu göndermek zorunda kalacaktı. Tolgar, bir silaha dönüşmüştü, kontrolsüz ve tehlikeli. Sonsuz bir savaşın başlangıcıydı bu.",,"[{""bubbleType"": ""speech"", ""dialogue"": null, ""imageUrl"": ""https://d2xsxph8kpxj0f.cloudfront.net/310519663399842622/cuoraNs8SGWCiJUcwSXm4W/panels/420001-page16-top-1773419841585.png"", ""narration"": ""Tolgar, peşindekilerle yüzleşirken güçlerini sonuna kadar kullanır."", ""position"": ""top-right"", ""speaker"": null}, {""bubbleType"": ""speech"", ""dialogue"": null, ""imageUrl"": ""https://d2xsxph8kpxj0f.cloudfront.net/310519663399842622/cuoraNs8SGWCiJUcwSXm4W/panels/420001-page16-bottom-left-1773419844281.png"", ""narration"": ""Vücudundan yayılan enerji dalgaları düşmanlarını savururken mutasyonu hızlanır."", ""position"": ""top-left"", ""speaker"": null}, {""bubbleType"": ""speech"", ""dialogue"": null, ""imageUrl"": ""https://d2xsxph8kpxj0f.cloudfront.net/310519663399842622/cuoraNs8SGWCiJUcwSXm4W/panels/420001-page16-bottom-right-1773419846561.png"", ""narration"": ""Tolgar, kontrolsüz bir silaha dönüşerek sonsuz bir savaşın başlangıcını işaret eder."", ""position"": ""top-right"", ""speaker"": null}]",,,,,"[""enerji patlaması"", ""çığlıklar"", ""patlama""]",landscape,2026-03-13 16:38:30
420017,420001,17,A-A-A-B,0,"Tolgar, güçlerini gizleyerek sıradan bir hayat kurmaya çalıştı. Yeni bir şehirde, yeni bir kimlikle yaşamaya başladı. Ancak içindeki değişim ve peşindeki şirketin gölgesi onu asla terk etmedi. Her an tetikte yaşamak, onu yavaş yavaş tüketiyordu. Güçleri, gizli bir yük olarak kaldı ve Tolgar, asla tam anlamıyla huzur bulamadı. Normal bir hayat, onun için sadece bir hayalden ibaretti.",,"[{""bubbleType"": ""speech"", ""dialogue"": null, ""imageUrl"": ""https://d2xsxph8kpxj0f.cloudfront.net/310519663399842622/cuoraNs8SGWCiJUcwSXm4W/panels/420001-page17-top-1773419846919.png"", ""narration"": ""Tolgar, yeni bir şehirde güçlerini gizleyerek sıradan bir hayat kurmaya çalışıyor."", ""position"": ""top-right"", ""speaker"": null}, {""bubbleType"": ""speech"", ""dialogue"": null, ""imageUrl"": ""https://d2xsxph8kpxj0f.cloudfront.net/310519663399842622/cuoraNs8SGWCiJUcwSXm4W/panels/420001-page17-bottom-left-1773419852003.png"", ""narration"": ""Ancak içindeki değişim ve peşindeki şirketin gölgesi onu asla terk etmiyor."", ""position"": ""top-left"", ""speaker"": null}, {""bubbleType"": ""speech"", ""dialogue"": null, ""imageUrl"": ""https://d2xsxph8kpxj0f.cloudfront.net/310519663399842622/cuoraNs8SGWCiJUcwSXm4W/panels/420001-page17-bottom-right-1773419857098.png"", ""narration"": ""Her an tetikte yaşamak Tolgar'ı tüketiyor ve normal bir hayat hayal olarak kalıyor."", ""position"": ""top-right"", ""speaker"": null}]",,,,,"[""fısıltılar"", ""yalnızlık"", ""hüzün""]",landscape,2026-03-13 16:38:30
420018,420001,18,B-A,1,"Tolgar, güçlerini kontrol etme konusunda şaşırtıcı bir ilerleme kaydetti. Artık enerjiyi daha bilinçli bir şekilde yönlendirebiliyor, hatta küçük enerji patlamaları yaratabiliyordu. Ancak bu süreç, vücudunda gözle görülür değişikliklere yol açtı. Cildi hafifçe parlamaya başladı ve gözleri daha da yoğunlaştı. Bu yeni varoluşu kabullenecek miydi, yoksa hala bir umut var mıydı?",,"[{""bubbleType"": ""speech"", ""dialogue"": null, ""imageUrl"": ""https://d2xsxph8kpxj0f.cloudfront.net/310519663399842622/cuoraNs8SGWCiJUcwSXm4W/panels/420001-page18-top-1773419868007.png"", ""narration"": ""Tolgar, güçlerini kontrol etme konusunda şaşırtıcı bir ilerleme kaydetti ve enerjiyi bilinçli yönlendirebiliyordu."", ""position"": ""top-right"", ""speaker"": null}, {""bubbleType"": ""speech"", ""dialogue"": null, ""imageUrl"": ""https://d2xsxph8kpxj0f.cloudfront.net/310519663399842622/cuoraNs8SGWCiJUcwSXm4W/panels/420001-page18-bottom-left-1773419874489.png"", ""narration"": ""Bu süreç, Tolgar'ın vücudunda gözle görülür değişikliklere yol açtı; cildi parlıyor ve gözleri yoğunlaşıyordu."", ""position"": ""top-left"", ""speaker"": null}, {""bubbleType"": ""speech"", ""dialogue"": null, ""imageUrl"": ""https://d2xsxph8kpxj0f.cloudfront.net/310519663399842622/cuoraNs8SGWCiJUcwSXm4W/panels/420001-page18-bottom-right-1773419878602.png"", ""narration"": ""Tolgar, bu yeni varoluşunu kabullenecek miydi, yoksa hala bir umut var mıydı?"", ""position"": ""top-right"", ""speaker"": null}]",Yeni varlığını kabullen ve gücünü benimse.,Hala insan kalmaya çalış ve mutasyonu durdurmanın yolunu bul.,420019,420020,"[""enerji"", ""parlama"", ""dönüşüm""]",landscape,2026-03-13 16:38:30
420019,420001,19,B-A-A,0,"Tolgar, yeni varlığını tamamen kabullendi. Güçleri onun bir parçası olmuştu ve artık onları kontrol edebiliyordu. İnsanlık sınırlarının ötesine geçmiş, yeni bir türün öncüsü olmuştu. Şirket onu yakalamaya çalıştığında, Tolgar onlara karşı koydu ve kendi yolunu çizdi. Artık bir kahraman ya da bir kötü adam değil, sadece Tolgar'dı; evrimin bir sonraki adımı. Dünya, onunla birlikte değişecekti.",,"[{""bubbleType"": ""speech"", ""dialogue"": null, ""imageUrl"": ""https://d2xsxph8kpxj0f.cloudfront.net/310519663399842622/cuoraNs8SGWCiJUcwSXm4W/panels/420001-page19-top-1773419868009.png"", ""narration"": ""Tolgar, yeni güçlerini tamamen kabullenmiş ve onları kontrol ediyordu."", ""position"": ""top-right"", ""speaker"": null}, {""bubbleType"": ""speech"", ""dialogue"": null, ""imageUrl"": ""https://d2xsxph8kpxj0f.cloudfront.net/310519663399842622/cuoraNs8SGWCiJUcwSXm4W/panels/420001-page19-bottom-left-1773419868681.png"", ""narration"": ""Şirket onu yakalamaya çalıştığında, Tolgar kendi yolunu çizdi."", ""position"": ""top-left"", ""speaker"": null}, {""bubbleType"": ""speech"", ""dialogue"": null, ""imageUrl"": ""https://d2xsxph8kpxj0f.cloudfront.net/310519663399842622/cuoraNs8SGWCiJUcwSXm4W/panels/420001-page19-bottom-right-1773419874486.png"", ""narration"": ""Artık o sadece Tolgar'dı; evrimin bir sonraki adımı."", ""position"": ""top-right"", ""speaker"": null}]",,,,,"[""enerji patlaması"", ""zafer"", ""dönüşüm""]",landscape,2026-03-13 16:38:30
420020,420001,20,B-A-B,0,"Tolgar, insanlığını kaybetmemek için direndi. Mutasyonu durdurmanın yollarını aramaya devam etti, ancak her deneme onu daha da yoruyordu. Vücudundaki değişimler geri döndürülemezdi. Sonunda, güçlerinin ve mutasyonunun ağırlığı altında ezildi. Ne insan ne de tam anlamıyla mutasyonlu bir varlık olabildi. Tolgar, iki dünya arasında sıkışıp kalmış, trajik bir figür olarak kayboldu.",,"[{""bubbleType"": ""speech"", ""dialogue"": null, ""imageUrl"": ""https://d2xsxph8kpxj0f.cloudfront.net/310519663399842622/cuoraNs8SGWCiJUcwSXm4W/panels/420001-page20-top-1773419862588.png"", ""narration"": ""Tolgar, insanlığını kaybetmemek için direniyor, mutasyonu durdurmanın yollarını arıyor ama her deneme onu daha da yoruyor."", ""position"": ""top-right"", ""speaker"": null}, {""bubbleType"": ""speech"", ""dialogue"": null, ""imageUrl"": ""https://d2xsxph8kpxj0f.cloudfront.net/310519663399842622/cuoraNs8SGWCiJUcwSXm4W/panels/420001-page20-bottom-left-1773419868193.png"", ""narration"": ""Vücudundaki değişimler geri döndürülemez bir hal almıştır ve güçlerinin ağırlığı altında ezilmeye başlamıştır."", ""position"": ""top-left"", ""speaker"": null}, {""bubbleType"": ""speech"", ""dialogue"": null, ""imageUrl"": ""https://d2xsxph8kpxj0f.cloudfront.net/310519663399842622/cuoraNs8SGWCiJUcwSXm4W/panels/420001-page20-bottom-right-1773419868529.png"", ""narration"": ""Ne insan ne de tam anlamıyla mutasyonlu bir varlık olabilen Tolgar, iki dünya arasında sıkışıp kalmış trajik bir figür olarak kaybolur."", ""position"": ""top-right"", ""speaker"": null}]",,,,,"[""hüzün"", ""çaresizlik"", ""sessizlik""]",landscape,2026-03-13 16:38:31
420021,420001,21,B-B,1,"Antidot arayışları sonuçsuz kalan Tolgar, umutsuzluğa kapıldı. Güçleri kontrolsüz bir şekilde büyümeye devam ediyordu ve her an bir felakete yol açabilirdi. Şirket de onun peşindeydi, onu bir silah olarak kullanmak istiyordu. Tolgar, köşeye sıkışmıştı. Ne yapacaktı?",,"[{""bubbleType"": ""speech"", ""dialogue"": null, ""imageUrl"": ""https://d2xsxph8kpxj0f.cloudfront.net/310519663399842622/cuoraNs8SGWCiJUcwSXm4W/panels/420001-page21-top-1773419874523.png"", ""narration"": ""Antidot arayışları sonuçsuz kalan Tolgar, umutsuzluğa kapıldı."", ""position"": ""top-right"", ""speaker"": null}, {""bubbleType"": ""speech"", ""dialogue"": null, ""imageUrl"": ""https://d2xsxph8kpxj0f.cloudfront.net/310519663399842622/cuoraNs8SGWCiJUcwSXm4W/panels/420001-page21-bottom-left-1773419878692.png"", ""narration"": ""Güçleri kontrolsüz bir şekilde büyümeye devam ediyordu ve her an bir felakete yol açabilirdi."", ""position"": ""top-left"", ""speaker"": null}, {""bubbleType"": ""speech"", ""dialogue"": ""Ne yapacaktı?"", ""imageUrl"": ""https://d2xsxph8kpxj0f.cloudfront.net/310519663399842622/cuoraNs8SGWCiJUcwSXm4W/panels/420001-page21-bottom-right-1773419880378.png"", ""narration"": ""Şirket de onun peşindeydi, onu bir silah olarak kullanmak istiyordu; Tolgar, köşeye sıkışmıştı, ne yapacaktı?"", ""position"": ""top-right"", ""speaker"": ""Tolgar""}]",Güçlerini kabullen ve onlarla yaşamayı öğren.,Şirketle işbirliği yap ve bir antidot bulma karşılığında onlara yardım et.,420022,420023,"[""gergin müzik"", ""kalp atışı"", ""çaresizlik""]",landscape,2026-03-13 16:38:31
420022,420001,22,B-B-A,0,"Tolgar, güçlerini kabullenmekten başka çaresi kalmadığını anladı. Kontrolsüz enerjiyi kendi lehine çevirmeye çalıştı, ancak mutasyon o kadar ilerlemişti ki, vücudu artık insan formundan uzaklaşıyordu. Yavaş yavaş, insanlığını yitirerek, doğanın yeni ve bilinmeyen bir gücüne dönüştü. Şirket onu asla yakalayamadı, çünkü Tolgar, artık onların anlayamayacağı bir varlıktı. Bir efsaneye dönüştü, ormanların derinliklerinde, dağların zirvelerinde fısıldanan bir gölge.",,"[{""bubbleType"": ""speech"", ""dialogue"": null, ""imageUrl"": ""https://d2xsxph8kpxj0f.cloudfront.net/310519663399842622/cuoraNs8SGWCiJUcwSXm4W/panels/420001-page22-top-1773419886386.png"", ""narration"": ""Tolgar, güçlerini kabullenmekten başka çaresi kalmadığını anladı ve kontrolsüz enerjiyi kendi lehine çevirmeye çalıştı."", ""position"": ""top-right"", ""speaker"": null}, {""bubbleType"": ""speech"", ""dialogue"": null, ""imageUrl"": ""https://d2xsxph8kpxj0f.cloudfront.net/310519663399842622/cuoraNs8SGWCiJUcwSXm4W/panels/420001-page22-bottom-left-1773419889479.png"", ""narration"": ""Mutasyon o kadar ilerlemişti ki, vücudu insan formundan uzaklaşarak doğanın bilinmeyen bir gücüne dönüştü."", ""position"": ""top-left"", ""speaker"": null}, {""bubbleType"": ""speech"", ""dialogue"": null, ""imageUrl"": ""https://d2xsxph8kpxj0f.cloudfront.net/310519663399842622/cuoraNs8SGWCiJUcwSXm4W/panels/420001-page22-bottom-right-1773419889743.png"", ""narration"": ""Şirket onu asla yakalayamadı; Tolgar, ormanlarda ve dağlarda fısıldanan bir efsaneye dönüştü."", ""position"": ""top-right"", ""speaker"": null}]",,,,,"[""rüzgar"", ""uğultu"", ""doğa""]",landscape,2026-03-13 16:38:31
420023,420001,23,B-B-B,0,"Tolgar, şirketle işbirliği yapmaya karar verdi. Antidot bulma karşılığında, güçlerini şirket için kullanmayı kabul etti. Ancak şirket, Tolgar'ı sadece bir araç olarak görüyordu. Antidot vaadi asla gerçekleşmedi ve Tolgar, şirketin kontrolündeki güçlü bir silaha dönüştü. İradesi elinden alınmış, sadece emirleri uygulayan bir kukla haline geldi. Özgürlüğünü ve insanlığını kaybetmişti, bir laboratuvarın en tehlikeli deneyi olarak tarihe geçti.",,"[{""bubbleType"": ""speech"", ""dialogue"": null, ""imageUrl"": ""https://d2xsxph8kpxj0f.cloudfront.net/310519663399842622/cuoraNs8SGWCiJUcwSXm4W/panels/420001-page23-top-1773419900758.png"", ""narration"": ""Tolgar, antidot karşılığında güçlerini şirket için kullanmayı kabul eder."", ""position"": ""top-right"", ""speaker"": null}, {""bubbleType"": ""speech"", ""dialogue"": null, ""imageUrl"": ""https://d2xsxph8kpxj0f.cloudfront.net/310519663399842622/cuoraNs8SGWCiJUcwSXm4W/panels/420001-page23-bottom-left-1773419904411.png"", ""narration"": ""Şirket, Tolgar'ı bir araç olarak görür ve antidot vaadini asla yerine getirmez."", ""position"": ""top-left"", ""speaker"": null}, {""bubbleType"": ""speech"", ""dialogue"": null, ""imageUrl"": ""https://d2xsxph8kpxj0f.cloudfront.net/310519663399842622/cuoraNs8SGWCiJUcwSXm4W/panels/420001-page23-bottom-right-1773419904636.png"", ""narration"": ""Tolgar, iradesi elinden alınmış, şirketin kontrolündeki tehlikeli bir silaha dönüşür."", ""position"": ""top-right"", ""speaker"": null}]",,,,,"[""zincirler"", ""uğultu"", ""robotik ses""]",landscape,2026-03-13 16:38:31
450001,450002,1,root,0,"Bir gece, gökyüzünde parlayan Ay, sanki kocaman bir gümüş top gibi pencereye çok yaklaşmıştı. Küçük Tuğra, yuvarlak, açık mavi-gri gözleriyle dışarı bakarken, babası Tolgar'a sordu: ""Baba, biz Ay'a gidebilir miyiz?"" Tolgar, koyu kahverengi, badem şeklindeki gözleriyle oğluna sıcacık gülümsedi. Çünkü bazı sorular, tıpkı Tuğra'nınki gibi, gerçekten de sihirli kapıları açardı.

Tam o anda, Tuğra'nın odasındaki oyuncak roket hafifçe titredi ve sanki canlıymış gibi parlamaya başladı! Yumuşacık battaniyeler, pırıl pırıl yıldız tozuna dönüştü. Tolgar ve Tuğra, kendilerini bir anda roketin içinde buldular. Roket, bulutların arasından usulca yükselirken, Ay onlara ""Hoş geldiniz!"" der gibi gülümsüyordu.",https://d2xsxph8kpxj0f.cloudfront.net/310519663399842622/cuoraNs8SGWCiJUcwSXm4W/generated/1773430349887.png,,,,,,"[""magical"", ""rocket launch""]",portrait,2026-03-13 19:32:59
450002,450002,2,root,1,"Roketleri hızla gökyüzüne doğru yükselirken, küçük Tuğra pencereden dışarıya hayranlıkla baktı. Aşağıda, Dünya kocaman, mavi bir top gibi görünüyordu. Beyaz, pamuk gibi bulutlar yavaşça dönüyordu. Tuğra'nın gözleri bu muhteşem manzarayla ışıl ışıl parladı.

Tolgar, sıcak ve güven veren sesiyle, ""Şimdi atmosferin ilk katmanındayız, tatlım. Adı Troposfer,"" diye açıkladı. ""Burada hava akımları çok güçlü, tıpkı görünmez nehirler gibi. Dikkatli olmalıyız."" Tuğra, merakla babasına döndü. Minik sesi heyecanla doluydu. ""Peki ne yapacağız şimdi baba? Bu görünmez nehirleri nasıl geçeceğiz?""

Şimdi ne yapmalıydılar?

Choice A: Hava akımlarını kullanarak yükselmeye çalışın.
Choice B: Roketin motorlarını daha da güçlendirip akımları aşın.",https://d2xsxph8kpxj0f.cloudfront.net/310519663399842622/cuoraNs8SGWCiJUcwSXm4W/generated/1773430346107.png,,Hava akımlarını kullanarak yükselmeye çalışın.,Roketin motorlarını daha da güçlendirip akımları aşın.,450003,450004,"[""wind"", ""rocket engine""]",portrait,2026-03-13 19:32:59
450003,450002,3,A,1,"Tolgar, Tuğra'nın ışıl ışıl gözlerine bakarak gülümsedi. ""Bu görünmez nehirler bize yardım edebilir,"" dedi sıcak sesiyle. Parmakları roketin parlak kontrol düğmelerinde dans etti. Roket, sihirli bir kuş gibi kanatlarını açtı, rüzgarı dostu yaptı.

Hava akımları onları nazikçe yukarı taşıdı. Beyaz, pamuk bulutlar şimdi altlarında kalmıştı. ""Vay canına, baba!"" diye haykırdı Tuğra'nın yüksek sesi. ""Sanki kocaman bir kuş gibi süzülüyoruz!"" Roket, gökyüzünde dans ederek, yıldızlara doğru yükseliyordu.

Şimdi ne yapmalıydılar?

Ozon tabakasını geçmek için yavaşça süzülün.
Hızlıca geçmek için roketin hızını artırın.",https://d2xsxph8kpxj0f.cloudfront.net/310519663399842622/cuoraNs8SGWCiJUcwSXm4W/generated/1773430347848.png,,Ozon tabakasını geçmek için yavaşça süzülün.,Hızlıca geçmek için roketin hızını artırın.,450005,450006,"[""gliding"", ""wind""]",portrait,2026-03-13 19:32:59
450004,450002,4,B,1,"Tolgar, ""Akımlara karşı koymalıyız!"" diyerek roketin motorlarını son gücüne kadar çalıştırdı. Kocaman roket, güçlü bir uğultuyla titremeye başladı. Sanki dev bir balina, pamuktan denizi yararak ilerliyordu. Bir anda, roket bulutları delip geçti ve gökyüzünün daha sakin, mor renkli bir katmanına ulaştılar.

Tuğra, gözleri parlayarak, ""Çok hızlıydık baba! Sanki bir yıldız gibi fırladık!"" diye haykırdı. Tolgar, oğluna sıcak bir gülümsemeyle baktı. ""Evet, minik kahramanım. Şimdi daha sakin bir bölgedeyiz ama önümüzde parıldayan bir örtü var: ozon tabakası.""

Şimdi ne yapmalılar?
Choice A: Ozon tabakasını geçmek için yavaşça süzülün.
Choice B: Hızlıca geçmek için roketin hızını artırın.",https://d2xsxph8kpxj0f.cloudfront.net/310519663399842622/cuoraNs8SGWCiJUcwSXm4W/generated/1773430343248.png,,Ozon tabakasını geçmek için yavaşça süzülün.,Hızlıca geçmek için roketin hızını artırın.,450007,450008,"[""engine roar"", ""vibration""]",portrait,2026-03-13 19:32:59
450005,450002,5,A-A,1,"Tolgar, roketin kontrol paneline uzandı ve nazikçe bir düğmeye bastı. Roket, mor ötesi ışınlarla parlayan ozon tabakasında yavaşça süzülmeye başladı. Sanki gökyüzünde ışıl ışıl parlayan, rengarenk bir tünelden geçiyorlardı. Tuğra'nın yuvarlak, mavi-gri gözleri hayranlıkla büyüdü. ""Baba, burası ne kadar da güzel parlıyor, sanki renkli bir tünelden geçiyoruz!"" diye fısıldadı.

Tolgar, oğlunun yumuşak kahverengi saçlarını okşadı. ""Evet, tatlım,"" dedi sıcak sesiyle. ""Burası bizi zararlı ışınlardan koruyan sihirli bir kalkan. Tıpkı Dünya'mızın görünmez bir battaniyesi gibi."" Roket usulca ilerlerken, Ay'ın gümüş rengi yüzeyi artık çok daha yakından görünüyordu.

Şimdi ne yapmalıydılar?

Ay'ın yüzeyine inmek için yumuşak bir iniş yapın.
Ay'ın yörüngesinde kısa bir tur atıp etrafı keşfedin.",https://d2xsxph8kpxj0f.cloudfront.net/310519663399842622/cuoraNs8SGWCiJUcwSXm4W/generated/1773430351381.png,,Ay'ın yüzeyine inmek için yumuşak bir iniş yapın.,Ay'ın yörüngesinde kısa bir tur atıp etrafı keşfedin.,450009,450010,"[""shimmering"", ""soft hum""]",portrait,2026-03-13 19:33:00
450006,450002,6,A-B,1,"Tolgar, Tuğra'nın heyecanlı gözlerine bakarak gülümsedi. ""Hızlıca geçmeliyiz ki daha fazla enerji harcamayalım,"" dedi sıcak sesiyle. Parmakları roketin parlak düğmelerinde gezindi ve roketin hızı arttı. Bir anda, roket hafifçe sarsılarak ozon tabakasını geçti, sanki sihirli bir tünelden fırlamış gibi. Tuğra, yuvarlak gözleri kocaman açılmış bir şekilde, ""Çok hızlıydık baba, göz açıp kapayıncaya kadar geçtik!"" diye haykırdı.

Tolgar, oğlunun saçlarını okşadı. ""Evet, minik astronotum,"" dedi yumuşak bir sesle. ""Şimdi Ay'a daha da yakınız. Neredeyse oradayız, Ay bizi bekliyor!"" Dışarıda, yıldızlar daha da parlak görünüyordu ve Ay, kocaman, gümüş bir top gibi onlara gülümsüyordu.

Şimdi ne yapmalıydılar?

Ay'ın yüzeyine inmek için yumuşak bir iniş yapın.
Ay'ın yörüngesinde kısa bir tur atıp etrafı keşfedin.",https://d2xsxph8kpxj0f.cloudfront.net/310519663399842622/cuoraNs8SGWCiJUcwSXm4W/generated/1773430355847.png,,Ay'ın yüzeyine inmek için yumuşak bir iniş yapın.,Ay'ın yörüngesinde kısa bir tur atıp etrafı keşfedin.,450011,450012,"[""whoosh"", ""rocket boost""]",portrait,2026-03-13 19:33:00
450007,450002,7,B-A,1,"Tolgar, sıcak ve güven veren sesiyle, ""Ozon tabakası çok hassastır, minik yıldızım. Onu incitmeden, yavaşça geçmeliyiz,"" dedi. Kocaman roket, gökyüzündeki parıldayan örtünün içinden nazikçe süzülmeye başladı. Dışarıdaki mor ve yeşil ışıklar, Tuğra'nın gözlerinde dans ediyordu. Sanki binlerce minik pırıltı, roketin etrafında dönüyordu.

Tuğra, gözleri kocaman açılmış bir şekilde, ""Baba, sanki gökkuşağının içindeyiz!"" diye fısıldadı. Tolgar, oğluna sevgiyle gülümsedi. ""Evet, tatlım. Burası dünyamızın koruyucu kalkanı. Şimdi Ay'a çok yakınız, bembeyaz bir inci gibi parlıyor.""

Şimdi ne yapmalılar?
Choice A: Ay'ın yüzeyine inmek için yumuşak bir iniş yapın.
Choice B: Ay'ın yörüngesinde kısa bir tur atıp etrafı keşfedin.",https://d2xsxph8kpxj0f.cloudfront.net/310519663399842622/cuoraNs8SGWCiJUcwSXm4W/generated/1773430357528.png,,Ay'ın yüzeyine inmek için yumuşak bir iniş yapın.,Ay'ın yörüngesinde kısa bir tur atıp etrafı keşfedin.,450013,450014,"[""sparkle"", ""gentle hum""]",portrait,2026-03-13 19:33:00
450008,450002,8,B-B,1,"Tolgar, ""Zaman kaybetmeyelim, hızlanalım!"" diyerek motorlara tekrar güç verdi. Roket, parıldayan ozon tabakasından hızla geçti. Minik bir sarsıntı hissettiler, sanki görünmez, ışıltılı bir perdenin içinden geçmişlerdi. Tuğra, kocaman açtığı gözleriyle, ""Baba, sanki bir tünelden geçtik! Işıl ışıl bir tünelden!"" diye kıkırdadı.

Tolgar, oğlunun saçlarını okşadı. Sıcak sesiyle, ""Evet, minik kaşifim. Şimdi Ay'a çok yakınız, maceramızın sonuna doğru geliyoruz,"" dedi. Pencereden dışarı baktıklarında, kocaman, bembeyaz Ay onlara gülümsüyordu.

Şimdi ne yapmalılar?
Choice A: Ay'ın yüzeyine inmek için yumuşak bir iniş yapın.
Choice B: Ay'ın yörüngesinde kısa bir tur atıp etrafı keşfedin.",https://d2xsxph8kpxj0f.cloudfront.net/310519663399842622/cuoraNs8SGWCiJUcwSXm4W/generated/1773430361480.png,,Ay'ın yüzeyine inmek için yumuşak bir iniş yapın.,Ay'ın yörüngesinde kısa bir tur atıp etrafı keşfedin.,450015,450016,"[""acceleration"", ""light tremor""]",portrait,2026-03-13 19:33:00
